slide,title_kr,body_kr,title_vi,body_vi,cta_kr,cta_vi,disclaimer_kr,disclaimer_vi
1,"계약할 때 이건 꼭 확인!","","Khi ký hợp đồng, hãy kiểm tra điều này!","","체크리스트 더 보기","Xem checklist thêm","경험 공유, 법률 자문 아님","Chia sẻ trải nghiệm, không tư vấn pháp lý"
2,"보증금/계약서","임대인/주소 일치, 등기부 확인","Tiền cọc/HĐ","Chủ nhà/Địa chỉ khớp, sổ đỏ","","","",""
3,"사기징후","시세 대비 과도 조건/서류 미제공","Dấu hiệu lừa đảo","Điều kiện bất thường/Thiếu giấy tờ","","","",""
4,"보험/확인","전세/월세 보험/확정일자","Bảo hiểm/Xác nhận","Bảo hiểm/công chứng/xác nhận ngày hiệu lực","","","",""
5,"지금 저장","핵심 요약 + 링크","Lưu ngay","Tóm tắt + link","체크리스트 더 보기","Xem checklist thêm","경험 공유, 법률 자문 아님","Chia sẻ trải nghiệm, không tư vấn pháp lý"
