slide,title_kr,body_kr,title_vi,body_vi,cta_kr,cta_vi,disclaimer_kr,disclaimer_vi
1,"가장 많이 물어본 질문!","","Câu hỏi được hỏi nhiều nhất!","","더 많은 Q/A는 링크","Nhiều Q/A hơn ở link","경험 공유, 법률 자문 아님","Chia sẻ trải nghiệm, không tư vấn pháp lý"
2,"질문","비자 연장 언제 시작?","Câu hỏi","Gia hạn visa khi nào?","","","",""
3,"답변","만료 1개월 전 시작이 안전","Trả lời","Nên bắt đầu trước 1 tháng","","","",""
4,"팁","서류 3·가점 2 체크","Mẹo","3 hồ sơ chính · 2 điểm cộng","","","",""
5,"지금 저장","핵심 요약 + 링크","Lưu ngay","Tóm tắt + link","더 많은 Q/A는 링크","Nhiều Q/A hơn ở link","경험 공유, 법률 자문 아님","Chia sẻ trải nghiệm, không tư vấn pháp lý"
