slide,title_kr,body_kr,title_vi,body_vi,cta_kr,cta_vi,disclaimer_kr,disclaimer_vi
1,"E‑7 가점 핵심","","Điểm cộng E‑7 — cốt lõi","","체크리스트 저장","Lưu checklist","경험 공유, 법률 자문 아님","Chia sẻ trải nghiệm, không tư vấn pháp lý"
2,"가점 항목","TOPIK/KIIP, 우대 경력","Mục điểm cộng","TOPIK/KIIP, kinh nghiệm ưu tiên","","","",""
3,"증빙 일치","서류/기간 일치","Khớp chứng cứ","Hồ sơ/thời hạn khớp","","","",""
4,"주의","허위 정보/과장 주의","Lưu ý","Cảnh giác thông tin sai","","","",""
5,"지금 저장","핵심 요약 + 링크","Lưu ngay","Tóm tắt + link","체크리스트 저장","Lưu checklist","경험 공유, 법률 자문 아님","Chia sẻ trải nghiệm, không tư vấn pháp lý"
