slide,title_kr,body_kr,title_vi,body_vi,cta_kr,cta_vi,disclaimer_kr,disclaimer_vi
1,"Q/A 하이라이트 #3","","Q/A nổi bật #3","","더 많은 Q/A는 링크","Nhiều Q/A hơn ở link","경험 공유, 법률 자문 아님","Chia sẻ trải nghiệm, không tư vấn pháp lý"
2,"질문","가장 헷갈린 절차는?","Câu hỏi","Thủ tục nào dễ nhầm lẫn nhất?","","","",""
3,"답변","체크리스트로 단계별 정리","Trả lời","Checklist theo từng bước","","","",""
4,"팁","서류 3·가점 2·마감 관리","Mẹo","3 hồ sơ chính·2 điểm cộng·quản lý hạn","","","",""
5,"지금 저장","핵심 요약 + 링크","Lưu ngay","Tóm tắt + link","더 많은 Q/A는 링크","Nhiều Q/A hơn ở link","경험 공유, 법률 자문 아님","Chia sẻ trải nghiệm, không tư vấn pháp lý"
